{
  "id": "unknown-id",
  "cn_name": "夹竹桃",
  "en_name": "Oleander",
  "scientific_name": "Nerium oleander",
  "category": "non_edible",
  "edible_parts": [],
  "toxicity": {
    "status": "safe",
    "toxic_parts": [],
    "notes": "",
    "sources": []
  },
  "cultivation": {
    "hardiness": "",
    "sun": "",
    "soil": "",
    "pH": "",
    "watering": "",
    "propagation": [],
    "companion": [],
    "pests": []
  },
  "varieties": [],
  "chemistry": [],
  "culinary_uses": [],
  "storage": "",
  "lookalikes": [],
  "images": [],
  "references": [],
  "tags": []
}